{
  "id": "arxiv:2505.19241",
  "title": "ActiveDPO: Active Direct Preference Optimization for Sample-Efficient Alignment",
  "authors": [
    "author:bryan-low"
  ],
  "year": 2026,
  "venue": "ICLR",
  "url": "https://arxiv.org/abs/2505.19241",
  "abstract": "",
  "tags": {
    "method": [
      "train"
    ],
    "main_method": "train",
    "goal": [
      "helpfulness"
    ],
    "modal": "text",
    "setting": "standalone",
    "topic": [
      "preference-data"
    ]
  },
  "summary": {
    "claim": "",
    "condition": "",
    "gap": ""
  },
  "status": "confirmed",
  "source": "manual",
  "provenance": {
    "summary_model": "manual",
    "created_at": "2026-10-14"
  }
}