{
  "id": "arxiv:2601.04277",
  "title": "Unlocking the Pre-Trained Model as a Dual-Alignment Calibrator for Post-Trained LLMs",
  "authors": [],
  "year": 2026,
  "venue": "arXiv",
  "url": "https://arxiv.org/abs/2601.04277",
  "abstract": "",
  "tags": {
    "method": [
      "inference"
    ],
    "main_method": "inference",
    "goal": [
      "honesty"
    ],
    "modal": "text",
    "setting": "standalone",
    "topic": [
      "calibration"
    ]
  },
  "summary": {
    "claim": "",
    "condition": "",
    "gap": ""
  },
  "status": "confirmed",
  "source": "manual",
  "provenance": {
    "summary_model": "manual",
    "created_at": "2026-10-14"
  }
}