{
  "id": "arxiv:2609.18453",
  "title": "The Mirage of Calibrated Confidence: Verbalized Confidence in Vision-Language Models",
  "authors": [],
  "year": 2026,
  "venue": "arXiv",
  "url": "https://arxiv.org/abs/2609.18453",
  "abstract": "",
  "tags": {
    "method": [
      "analysis"
    ],
    "main_method": "analysis",
    "goal": [
      "honesty"
    ],
    "modal": "multimodal",
    "setting": "standalone",
    "topic": [
      "calibration"
    ]
  },
  "summary": {
    "claim": "",
    "condition": "",
    "gap": ""
  },
  "status": "hold",
  "source": "manual",
  "provenance": {
    "summary_model": "manual",
    "created_at": "2026-10-14"
  }
}