{
  "id": "arxiv:2602.03328",
  "title": "GuardReasoner-Omni: A Reasoning-based Multi-modal Guardrail",
  "authors": [],
  "year": 2026,
  "venue": "arXiv",
  "url": "https://arxiv.org/abs/2602.03328",
  "abstract": "",
  "tags": {
    "method": [
      "train"
    ],
    "main_method": "train",
    "goal": [
      "harmlessness"
    ],
    "modal": "multimodal",
    "setting": "standalone",
    "topic": [
      "guardrail"
    ]
  },
  "summary": {
    "claim": "",
    "condition": "",
    "gap": ""
  },
  "status": "new",
  "source": "manual",
  "provenance": {
    "summary_model": "manual",
    "created_at": "2026-10-14"
  }
}