{
  "id": "arxiv:2602.20102",
  "title": "BarrierSteer: LLM Safety via Learning Barrier Steering",
  "authors": [
    "author:bryan-low"
  ],
  "year": 2026,
  "venue": "arXiv",
  "url": "https://arxiv.org/abs/2602.20102",
  "abstract": "",
  "tags": {
    "method": [
      "inference"
    ],
    "main_method": "inference",
    "goal": [
      "harmlessness"
    ],
    "modal": "text",
    "setting": "standalone",
    "topic": [
      "steering"
    ]
  },
  "summary": {
    "claim": "",
    "condition": "",
    "gap": ""
  },
  "status": "confirmed",
  "source": "manual",
  "provenance": {
    "summary_model": "manual",
    "created_at": "2026-10-14"
  }
}