{
  "id": "arxiv:2507.13255",
  "title": "Automating Steering for Safe Multimodal Large Language Models",
  "authors": [
    "author:bryan-hooi"
  ],
  "year": 2025,
  "venue": "EMNLP",
  "url": "https://arxiv.org/abs/2507.13255",
  "abstract": "",
  "tags": {
    "method": [
      "inference"
    ],
    "main_method": "inference",
    "goal": [
      "harmlessness"
    ],
    "modal": "multimodal",
    "setting": "standalone",
    "topic": [
      "steering"
    ]
  },
  "summary": {
    "claim": "",
    "condition": "",
    "gap": ""
  },
  "status": "confirmed",
  "source": "manual",
  "provenance": {
    "summary_model": "manual",
    "created_at": "2026-10-14"
  }
}