{
  "id": "arxiv:2505.11049",
  "title": "GuardReasoner-VL: Safeguarding VLMs via Reinforced Reasoning",
  "authors": [
    "author:bryan-hooi"
  ],
  "year": 2025,
  "venue": "NeurIPS",
  "url": "https://arxiv.org/abs/2505.11049",
  "abstract": "",
  "tags": {
    "method": [
      "train"
    ],
    "main_method": "train",
    "goal": [
      "harmlessness"
    ],
    "modal": "multimodal",
    "setting": "standalone",
    "topic": [
      "guardrail"
    ]
  },
  "summary": {
    "claim": "",
    "condition": "",
    "gap": ""
  },
  "status": "confirmed",
  "source": "manual",
  "provenance": {
    "summary_model": "manual",
    "created_at": "2026-10-14"
  }
}