{
  "id": "arxiv:2506.07022",
  "title": "AlphaSteer: Learning Refusal Steering with Principled Null-Space Constraint",
  "authors": [],
  "year": 2025,
  "venue": "arXiv",
  "url": "https://arxiv.org/abs/2506.07022",
  "abstract": "",
  "tags": {
    "method": [
      "inference"
    ],
    "main_method": "inference",
    "goal": [
      "harmlessness",
      "helpfulness"
    ],
    "modal": "text",
    "setting": "standalone",
    "topic": [
      "steering",
      "over-refusal"
    ]
  },
  "summary": {
    "claim": "",
    "condition": "",
    "gap": ""
  },
  "status": "confirmed",
  "source": "manual",
  "provenance": {
    "summary_model": "manual",
    "created_at": "2026-10-14"
  }
}